slug,title
text-recognition,Copy text from images on Firefox for MacOS
firefox-privacy-and-security-features,Firefox privacy and security features
recommended-firefox-privacy-and-security-settings-families,Recommended Firefox privacy and security settings for families
recommended-firefox-extensions-families-and-students,Recommended Firefox extensions for families and students
disable-password-saving-firefox,Disable password saving in Firefox
disable-credit-card-syncing-across-devices,Disable credit card and payment method syncing across devices
block-deceptive-content-and-dangerous-downloads-firefox,Block deceptive content and dangerous downloads in Firefox
quick-actions-firefox-search-bar,Quick actions in the Firefox search bar
whats-new-firefox-ios-version-104,What's new in Firefox for iOS (version 104)
upgrade-error,Why do I get an error when I try to upgrade my subscription?
automatically-fill-your-address-web-forms-android,Automatically fill in your address on web forms in Firefox for Android
firefox-enterprise-104-release-notes,Firefox for Enterprise 104 - Release notes
whats-new-firefox-klar-ios-version-103,What's new in Firefox Klar for iOS (version 103)
whats-new-firefox-klar-ios-version-104,What's new in Firefox Klar for iOS (version 104)
whats-new-firefox-ios-version-105,What's new in Firefox for iOS (version 105)
how-do-i-redeem-coupon-code,How do I redeem a coupon code?
manage-newsletter-and-email-preferences,Manage your Mozilla account newsletter and email preferences
mask-your-phone-number-relay-phone-masking,Mask your phone number with Relay Phone Masking
relay-phone-masking-how-long-can-i-talk-when-i-get-a-phone-call,Relay Phone Masking - How long can I talk when I get a call?
how-do-i-block-phone-calls-or-texts-my-relay-phone,How do I block phone calls or texts to my Relay Phone mask?
how-do-i-reply-text-message-sent-my-phone-mask,How do I reply to a text message sent to my phone mask?
whats-new-firefox-klar-ios-version-105,What's new in Firefox Klar for iOS (version 105)
whats-new-firefox-ios-version-106,What's new in Firefox for iOS (version 106)
how-does-firefox-ios-use-permissions-it-requests,How does Firefox for iOS use the permissions it requests?
mozilla-vpn-message-center,Mozilla VPN message center
whats-new-firefox-klar-ios-version-106,What's new in Firefox Klar for iOS (version 106)
firefox-update-notifications-windows,Firefox update notifications on Windows
whats-new-firefox-ios-version-107,What's new in Firefox for iOS (version 107)
firefox-hangs-when-copying-suggested-actions-windows-11,Firefox hangs when copying with Suggested Actions enabled on Windows 11 - What to do
how-do-i-upgrade-my-subscription,Upgrade your subscription
how-enable-disable-firefox-relay-icon-on-online-fields-and-websites,How to disable the Firefox Relay autofill icon on online fields and websites
site-permission-add-ons,Site Permission Add-ons
how-can-i-tell-if-mozilla-vpn-connected,How can I tell if Mozilla VPN is connected?
firefox-enterprise-107-release-notes,Firefox for Enterprise 107 - Release notes
cookie-banner-reduction,Block cookie banners on Firefox
whats-new-firefox-ios-version-108,What's new in Firefox for iOS (version 108)
save-web-pages-pdf-firefox-android,Save web pages as PDF in Firefox for Android
extensions-button,Manage your extensions using the extensions button in the toolbar
what-should-i-do-if-im-redirected,What should I do if I'm redirected to the Firefox Relay FAQ when clicking a link within an email?
how-do-i-report-issue-firefox-relay,How do I report an issue with Firefox Relay?
cookie-banner-reduction-firefox-android,Block cookie banners on Firefox for Android
domains-allow-firefox,Domains to allow for Firefox
whats-new-firefox-ios-version-109,What's new in Firefox for iOS (version 109)
whats-new-firefox-klar-ios-version-107,What's new in Firefox Klar for iOS (version 107)
mozilla-people-directory-managing-account-data,Mozilla People Directory - Managing account data
whats-new-firefox-focus-ios,What's New in Firefox Focus for iOS
save-web-pages-pdfs-firefox-ios,Save web pages as PDFs in Firefox for iOS
firefox-ios-xcode-simulator,Firefox for iOS (Xcode Simulator)
firefox-android-android-studio-emulator,Firefox for Android (Android Studio Emulator)
firefox-enterprise-109-release-notes,Firefox for Enterprise 109 - Release notes
upgrading-older-version-thunderbird,Upgrading from an older version of Thunderbird
how-download-and-install-mozilla-vpn-android,How to download and install Mozilla VPN on Android
how-download-and-install-mozilla-vpn-ios,Download and install Mozilla VPN on iOS
how-download-and-install-mozilla-vpn-windows,Download and install Mozilla VPN on Windows
how-download-and-install-mozilla-vpn-macos,How to download and install Mozilla VPN on macOS
x-mouse-button-control-firefox-110,X-Mouse Button Control in Firefox 110
get-started-firefox-monitor,Get started with Mozilla Monitor
how-do-i-opt-out-firefox-monitor,How do I opt out of Mozilla Monitor?
resolve-breaches-firefox-monitor,Resolve breaches with Mozilla Monitor
install-firefox-relay-extension-firefox-android,Install the Firefox Relay extension in Firefox for Android
microsoft-oauth-authentication-and-thunderbird-202,Microsoft OAuth Authentication and Thunderbird in 2024
firefox-enterprise-110-release-notes,Firefox for Enterprise 110 - Release notes
how-use-firefox-containers,How to use Firefox containers
relay-integration,Add Firefox Relay to the Firefox password manager
whats-new-firefox-ios-version-111,What's new in Firefox for iOS (version 111)
whats-new-firefox-klar-ios,What's New in Firefox Klar for iOS
how-does-firefox-focus-android-use-permissions-it-requests,How does Firefox Focus for Android use the permissions it requests?
how-does-firefox-focus-ios-use-permissions-it-requests,How does Firefox Focus for iOS use the permissions it requests?
how-does-firefox-klar-android-use-permissions-it-requests,How does Firefox Klar for Android use the permissions it requests?
how-does-firefox-klar-ios-use-permissions-it-requests,How does Firefox Klar for iOS use the permissions it requests?
how-do-i-monitor-multiple-email-addresses,How do I monitor multiple email addresses?
how-do-i-change-my-privacy-features,How do I change my Privacy features?
how-do-i-change-my-dns-settings,How do I change my DNS settings?
general-questions-about-privacy-protection-scans,General questions about privacy protection scans
firefox-enterprise-112-release-notes,Firefox for Enterprise 112 - Release notes
turn-ads-mdn-plus,Turn off ads on MDN Plus
why-do-i-get-harmful-download-message-when-downloading-firefox-windows,Why do I get a harmful download message when downloading Firefox on Windows?
firefox-enterprise-113-release-notes,Firefox for Enterprise 113 - Release notes
recommendations-firefox-new-tab,Recommended stories on the Firefox New Tab page - FAQ
how-automatically-label-your-new-email-masks,How to automatically label your new email masks
general-questions-about-relay-email-domains,General questions about Relay email domains
website-translation,Firefox Translation
firefox-private-network-no-longer-available,End of support for Firefox Private Network
new-thunderbird-115-supernova,New in Thunderbird 115 Supernova
switching-devices,Back up and transfer your Firefox data to a new device
addons-restricted-domains,Why aren’t my add-ons working on some websites?
dns-over-https,Configure DNS over HTTPS protection levels in Firefox
quarantined-domains,Why are some add-ons not allowed on sites restricted by Mozilla?
add-website-shortcut-your-home-screen-ios,Add a website shortcut to your home screen on iOS
firefox-users-macos-1012-1013-1014-moving-to-extended-support,"Firefox users on macOS 10.12, 10.13 and 10.14 moving to Extended Support Release"
firefox-users-windows-7-8-and-81-moving-extended-support,"Firefox support for Windows 7, 8, and 8.1"
firefox-enterprise-114-release-notes,Firefox for Enterprise 114 - Release notes
how-reset-your-password-without-account-recovery-keys-access-data,How to reset your password without Account Recovery Keys and regain access to your data
add-website-shortcut-your-home-screen-android,Add a website shortcut to your home screen on Android
get-your-local-weather-forecast-firefox-address-bar,Get your local weather forecast from the Firefox address bar
firefox-enterprise-115-release-notes,Firefox for Enterprise 115 - Release notes
what-languages-mozilla-vpn-available,What languages is Mozilla VPN available in?
getting-started-thunderbird-main-window-supernova,Getting Started with the Thunderbird main window (Supernova and newer)
unified-toolbar,Unified Toolbar
autofill-credit-cards-firefox-ios,Autofill Credit Cards in Firefox for iOS
userchromecss-js-usercontent-unsupported,userChrome.css and .js and userContent are unsupported
firefox-enterprise-116-release-notes,Firefox for Enterprise 116 - Release notes
in-what-languages-is-firefox-relay-available-in,In what languages is Firefox Relay available in?
how-can-i-contact-support-my-mozilla-vpn-app,Contact support from my Mozilla VPN app
how-view-and-manage-saved-articles-pocket-ios,How to View and Manage Saved Articles in Pocket for iOS
how-do-i-cancel-my-subscription-firefox-relay,How do I cancel my subscription to Firefox Relay?
global-privacy-control,Global Privacy Control
exporting-your-pocket-list,How to export your Pocket saves
pocket-premium-faq,Pocket Premium FAQ
pocket-premium-full-text-search,Pocket Premium Full-Text Search
pocket-premium-suggested-tags,Pocket Premium Suggested Tags
pocket-premium-permanent-library,Pocket Premium Permanent Library
searching-for-tags-with-pocket-premium,Searching for tags with Pocket Premium
firefox-enterprise-117-release-notes,Firefox for Enterprise 117 - Release notes
trouble-activating-or-restoring-your-pocket-premium-subscription,Trouble activating or restoring your Pocket Premium subscription
what-is-the-difference-between-pocket-free-and-premium-accounts,What features are included in Pocket Premium?
thunderbird-matrix-chat-faq,Thunderbird Matrix Chat FAQ
thunderbird-115-supernova-faq,Thunderbird 115 Supernova FAQ
firefox-enterprise-118-release-notes,Firefox for Enterprise 118 - Release notes
firefox-accounts-renamed-mozilla-accounts,Firefox accounts renamed Mozilla accounts - What you need to know
review-checker-review-quality,Shop online with more confidence using Firefox Review Checker
using-save-pocket-extension-google-chrome,Use the Save to Pocket extension for Google Chrome
using-save-pocket-extension-safari,Use the Save to Pocket extension for Safari
troubleshooting-save-button-issues-pocket-chrome,Troubleshooting Save Button issues with Pocket Chrome extension
using-save-pocket-extension-microsoft-edge,Using the Save to Pocket extension in Microsoft Edge
using-save-pocket-extension-brave-opera-and-vivald,"Using the Save to Pocket extension in Brave, Opera and Vivaldi"
understand-encrypted-client-hello,Understand Encrypted Client Hello (ECH)
faq-encrypted-client-hello,Encrypted Client Hello (ECH) - Frequently asked questions
editorial-guidelines-mozilla-accounts,Editorial guidelines for Mozilla accounts
why-cant-i-use-firefox-sync-my-google-or-apple-id,Why can’t I use Firefox sync with my Google or Apple ID?
unlink-google-or-apple-id-your-account,Unlink your Google or Apple ID from your Mozilla account
sign-in-accounts-using-3rd-party-auth,Sign in to a Mozilla account using 3rd-party authentication
content-community-best-practices-bugzilla-tickets,Content community best practices for Bugzilla tickets
use-google-trending-search-firefox-address-bar,Use Google Trending Search in the Firefox address bar
open-firefox-automatically-when-you-start-computer,Open Firefox automatically when you start your computer
relay-phone-masking-faq,Relay Phone Masking FAQ
use-browser-print-function-firefox-android,Use the in-browser print function on Firefox for Android
well-known-sources-for-downloading-thunderbird,Well known sources for downloading the Thunderbird email software
verifying-thunderbird-software-package,Verify a Mozilla Thunderbird installation package
faq-encrypted-client-hello-redirect-2,Placeholder article 091802
firefox-enterprise-120-release-notes,Firefox for Enterprise 120 - Release notes
firefox-enterprise-119-release-notes,Firefox for Enterprise 119 - Release notes
automatically-trust-third-party-certificates,Automatically trust third-party root certificates
avoid-getting-locked-out-your-mozilla-account,Avoid getting locked out of your Mozilla account
how-does-monitor-plus-work,How does Monitor Plus work?
firefox_suggest_mobile,Firefox Suggest for Mobile
contributor-policy-generative-ai-usage,"Contributor Policy - Usage of Generative AI (e.g., ChatGPT)"
android-translation,Firefox translation for Android
firefox-enterprise-121-release-notes,Firefox for Enterprise 121 - Release notes
sync,Sync Firefox data
using-firefox-android-view-saved-pdf-files,Open PDFs in Firefox for Android
firefox-enterprise-122-release-notes,Firefox for Enterprise 122 - Release notes
delete-email-mask,How to delete an email mask
get-started-monitor-plus,Get started with Monitor Plus
how-upgrade-monitor-plus,How to upgrade to Monitor Plus?
data-broker-scan,Data broker scan
how-do-i-request-refund-monitor-plus,How do I request a refund for Monitor Plus?
how-go-back-mozilla-monitors-free-version,Switch back to Mozilla Monitor’s free plan
how-do-i-contact-support-monitor-plus,How do I contact support for Monitor Plus?
firefox-enterprise-123-release-notes,Firefox for Enterprise 123 - Release notes
global-privacy-control-firefox-android,Global Privacy Control in Firefox for Android
firefox-version-support-policy,Firefox version support policy for Knowledge Base content
firefox-enterprise-124-release-notes,Firefox for Enterprise 124 - Release notes
use-eyedropper-tool-firefox,Use the Eyedropper tool in Firefox to sample colors
about-article-type-best-practices,"""About"" article type best practices"
how-to-article-type-best-practices,"""How-to"" article type best practices"
troubleshooting-article-type-best-practices,"""Troubleshooting"" article type best practices"
faq-article-type-best-practices,"""FAQ"" article type best practices"
firefox-enterprise-125-release-notes,Firefox for Enterprise 125 - Release notes
address-autofill-firefox,Address autofill on Firefox
instructions-smime-certificate-using-csr,Instructions for obtaining a personal S/MIME certificate by creating a CSR
data-loss-prevention,Data Loss Prevention
icon-gallery-firefox-desktop,Firefox desktop icon gallery for SUMO contributors
firefox-enterprise-126-release-notes,Firefox for Enterprise 126 - Release notes
report-inappropriate-content,How to report inappropriate content on Mozilla Support
how-delete-my-mozilla-account-mozilla-vpn-app-ios,How to delete my Mozilla account via the Mozilla VPN app on Android and iOS
enable-or-disable-local-network-access-ios,Enable or disable Local Network Access on iOS
privacy-preserving-attribution,Privacy-Preserving Attribution
manage-optional-permissions-android-extensions,Manage optional permissions for Firefox extensions on Android
openpgp-secret-keys-with-unsupported-feature-flags,Using OpenPGP secret keys that advertise features that are not supported by Thunderbird
end-support-mozilla-hubs,End of support for Mozilla Hubs
firefox-enterprise-127-release-notes,Firefox for Enterprise 127 - Release notes
monitor-status-indicators,Monitor status indicators
contribution-area,Update your contribution area
tab-overview-menu,Tab overview menu
firefox-enterprise-128-release-notes,Firefox for Enterprise 128 - Release notes
new-thunderbird-128-nebula,New in Thunderbird 128 Nebula
block-links-opening-external-apps,Block links from opening in external apps
multiwindow-support-ipad-firefox,Multiwindow support on iPad for Firefox
sequential-step-markers-list,Sequential step markers list
thunderbird-128-nebula-faq,Thunderbird 128 Nebula FAQ
pdf-alt-text,Add alt text to images in your PDFs using Firefox
root-certificate-expiration,Update Firefox to prevent add-ons issues from root certificate expiration
firefox-enterprise-129-release-notes,Firefox for Enterprise 129 - Release notes
submit-sumo-knowledge-base-content-request,Submit a SUMO knowledge base content request
choose-your-preferred-pdf-viewer-firefox,Choose your preferred PDF viewer in Firefox
back-your-firefox-installation-folder,Back up your Firefox installation folder
resolve-installation-error-windows,Resolve “The installation seems to be incomplete/corrupt” error in Firefox on Windows
firefox-enterprise-130-release-notes,Firefox for Enterprise 130 - Release notes
generate-strong-passwords-firefox-android,Generate strong passwords in Firefox for Android
firefox-labs-explore-experimental-features-firefox,Firefox Labs - Explore experimental features in Firefox
profile-management,Manage Firefox profiles
getting-started-thunderbird,Get started with Thunderbird
how-review-checker-preserves-user-privacy,How Review Checker preserves user privacy
rcs-messaging-and-mozilla-vpn,RCS messaging and Mozilla VPN
integrate-firefox-relay-firefox-password-manager,Integrate Firefox Relay into the Firefox Password Manager
firefox-blocked-macos-15-sequoia-firewall-what-you,Firefox blocked by macOS 15 Sequoia firewall - What you need to know
ai-chatbot,Access AI chatbots in Firefox
thunderbird-mobile-telemetry,Thunderbird Mobile Telemetry
firefox-enterprise-131-release-notes,Firefox for Enterprise 131 - Release notes
thunderbird-android-import,Import settings and data into Thunderbird for Android
resist-fingerprinting,Resist Fingerprinting
usage-ping-settings,Manage daily usage ping data collection settings in Firefox
securing-new-partner-monitor-plus,Securing a New Partner for Monitor Plus
why-mozilla--show-me-data-breach-site-never-signed-to,Why does Monitor show me in a data breach for a site I never signed up to?
thunderbird-android-8-faq,Thunderbird for Android 8 FAQ
firefox-enterprise-132-release-notes,Firefox for Enterprise 132 - Release notes
screen-sharing-warning-macos-15-sequoia,Address screen sharing issues with Firefox on macOS 15 Sequoia
new-thunderbird-android-version-8,New in Thunderbird for Android version 8
how-change-or-reset-your-mozilla-account-password,How to change or reset your Mozilla account password
firefox-macos-session-resume-feature,Firefox macOS session resume feature
configure-push-email-thunderbird-android,Configure push email for Thunderbird for Android
getting-started-thunderbird-android,Getting started with Thunderbird for Android
openpgp-thunderbird-android-howto,OpenPGP in Thunderbird for Android - How To
notifications-thunderbird,Notifications in Thunderbird
firefox-enterprise-133-release-notes,Firefox for Enterprise 133 - Release notes
gmail-thunderbird-android,Gmail and Thunderbird for Android
get-started-mozilla-vpn-extension,Get started with the Mozilla VPN extension
disable-vpn-protection-specific-website,Disable Mozilla VPN protection for a specific website
change-your-location-specific-website,Change your location for a specific website
how-will-dns-work-when-using-vpn-extension,How will DNS work when using the VPN extension?
program-your-computer-interferes-mozilla-vpn-exten,A program on your computer interferes with the Mozilla VPN extension
if-another-extension-interferes-mozilla-vpn,What to do if another extension interferes with the Mozilla VPN extension
manage-vpn-extension-preferences,Manage the Mozilla VPN extension preferences
technical-and-interaction-data,Manage technical and interaction data collection settings in Firefox
marketing-data,Manage marketing data settings in Firefox for Desktop
crash-report,Crash reports in Firefox for Desktop
manage-your-monitor-notifications,Manage your Monitor notifications
best-practices-gifs,Best practices to use GIFs in KB articles
https-upgrades,Firefox connection upgrades - HTTP to HTTPS
https-first,HTTPS-First upgrades to secure connections
https-upgrades-redirect-1,Placeholder Bug 1929565
mobile-marketing-data,Manage marketing data settings in Firefox for Android
review-mozilla-account-activity-and-protect-data,Review your Mozilla account activity and protect your data
secure-mozilla-account-two-step-authentication,Secure your Mozilla account with Two-Step Authentication
trouble-accepting-my-renewal-offer-monit,I have trouble accepting my renewal offer for Monitor Plus
ios-crash-reports-pref,Crash reports in Firefox for iOS
linux-security-warning,Firefox security features warning on Linux
community-forums-availability,Community Forums locale availability
ohttp-explained,Oblivious HTTP (OHTTP) explained
mozilla-account-deletion-inactivity,Mozilla account deletion due to inactivity
use-sidebar-access-tools-and-vertical-tabs,Use the sidebar to access tools and vertical tabs
firefox-enterprise-136-release-notes,Firefox for Enterprise 136 - Release notes
manage-firefox-data-collection-privacy-settings,Manage Firefox data collection and privacy settings
mobile-manage-firefox-data-collection-and-privacy,Mobile - Manage Firefox data collection and privacy settings
firefox-androids-protection-against-fingerprinters,Firefox for Android’s protection against fingerprinters
thunderbird-daily,Thunderbird Daily
add-edit-your-monitor-information,Add or edit your Monitor information
generate-strong-passwords-firefox-ios,Generate strong passwords in Firefox for iOS
tab-groups,Tab groups in Firefox
how-it-works-firefox-weather,How it works - Firefox Weather
firefox-enterprise-137-release-notes,Firefox for Enterprise 137 - Release notes
orbit-frequently-asked-questions,Orbit Frequently Asked Questions
how-use-ai-enhanced-tab-groups,How to use AI-enhanced tab groups
sumo-profile-inactive-deleted,What happens when your SUMO profile is inactive or deleted
allow-vpn-run-background-macos,Allow Mozilla VPN to run in the background on macOS
customize-your-firefox-app-icon-ios,Customize your Firefox app icon on iOS
firefox-enterprise-138-release-notes,Firefox for Enterprise 138 - Release notes
thunderbird-smtp-ehlo,How Thunderbird for Android avoids leaking your IP address to SMTP servers
choosing-thunderbird-release-channel,How to select a Thunderbird release channel
configure-dns-over-https-protection-levels-firefox-android,Configure DNS over HTTPS protection levels in Firefox for Android
firefox-contrast-control,Make reading easier with Firefox's contrast control settings
on-device-models,On-device AI models in Firefox
thunderbird-release,Thunderbird Release
solve-math-calculations-directly-your-firefox-addr,Solve math calculations directly in your Firefox address bar
future-of-pocket,Pocket has shut down - What you need to know
firefox-enterprise-139-release-notes,Firefox for Enterprise 139 - Release notes
reset-mozilla-account-password-credentials,Reset your Mozilla account password to protect your credentials
set-firefox-mail-default-windows,Set Firefox as your mail-to default on Windows
firefox-helper-tool-macos,Troubleshoot Firefox updates and the Helper tool
firefox-terms-of-use-faq,Firefox Terms of Use FAQ
unload-tabs-reduce-memory-usage-firefox,Unload tabs to reduce system memory usage in Firefox
screen-lock-private-browsing-firefox-android,Lock your private tabs on Firefox for Android
add-custom-search-engine-firefox,Add custom search engines in Firefox
mdn-subscription-signup,Learn how to subscribe to MDN Plus
firefox-enterprise-140-release-notes,Firefox for Enterprise 140 - Release notes
set-opening-screen-firefox-android,Choose your opening screen for Firefox for Android
thunderbird-release-notes-whats-new-and-known-issu,Thunderbird release notes - What's new and known issues
new-thunderbird-desktop,New in Thunderbird Desktop
appearance-panel-layout-message-list-card-view-tab,"Appearance Panel - Layout, Message List, Card View, Table View, Sorting and Threading settings"
use-ip-concealment-in-firefox,Use Firefox VPN in Firefox
explore-firefox-android-menu,Explore the Firefox for Android menu
thunderbird-esr,Thunderbird ESR
get-started-firefox-141-ios,Get started with Firefox 141 for iOS
firefox-enterprise-141-release-notes,Firefox for Enterprise 141 - Release notes
toolbar-firefox-ios,Explore the toolbar in Firefox for iOS
new-email-notifications-thunderbird,New email notifications in Thunderbird
about-your-important-data-and-their-files,About your important data and their files
menu-firefox-ios,Explore the Firefox for iOS menu
control-personal-device-local-network-permissions-firefox,Control personal device and local network permissions in Firefox
summarize-pages-ios,Use Firefox to summarize webpages
firefox-support-windows-10-end-support,What Windows 10 end of support means for Firefox users
manage-enhanced-tracking-protection-exceptions,Manage Enhanced Tracking Protection exceptions
unexpected-script-load,Understand unexpected script warnings in Firefox
firefox-enterprise-142-release-notes,Firefox for Enterprise 142 - Release notes
firefox-desktop-launcher,How the Firefox desktop launcher works
thunderbird-and-exchange,Thunderbird and Exchange
firefox-new-tab-widgets,Use widgets on your Firefox New Tab page
xframe-neterror-page-redirect-1,Website will not allow Firefox to display the page if another site has embedded it
firefox-new-tab-personalization,Control Firefox New Tab personalization
extension-data-collection,Extension data collection
control-personal-device-local-network-permissions-firefox-android,Control personal device and local network permissions on Firefox for Android
web-apps-firefox-windows,Use web apps in Firefox for Windows
custom-suggestions-firefox-address-bar,Get custom suggestions in the Firefox address bar
firefox-has-ended-support-32-bit-linux,Firefox has ended support for 32-bit Linux
use-link-previews-firefox,Preview webpages in Firefox with link preview
firefox-enterprise-143-release-notes,Firefox for Enterprise 143 - Release notes
new-thunderbird-android,New in Thunderbird for Android
