slug,title
markup-chart,Markup chart
fix-problems-images-not-show,Fix problems that cause images to not show
how-save-web-page,How to save a web page
how-search-from-address-bar,"How to search IMDB, Wikipedia and more from the address bar"
fix-common-audio-and-video-issues,Fix common audio and video issues
custom-installation-firefox-on-windows,Custom installation of Firefox on Windows
import-bookmarks-google-chrome,Import bookmarks and other data from Google Chrome
import-data-another-browser,Import data from another browser
live-bookmarks,Live Bookmarks - Subscribe to a web page for news and updates
firefox-page-info-window,View site information with Page Info
secure-connection-failed-firefox-did-not-connect,Secure connection and security warning error pages in Firefox
firefox-uses-too-much-memory-or-cpu-resources,Fix Firefox using too much memory or CPU resources
change-fonts-and-colors-websites-use,Change the fonts and colors websites use
websites-look-wrong-or-appear-differently,Websites look wrong or appear differently than they should
add-ons-cause-issues-are-on-blocklist,Why does Mozilla disable some add-ons from running in Firefox?
bookmarks-toolbar-display-favorite-websites,Bookmarks Toolbar - Display your favorite websites at the top of the Firefox window
bookmark-folders-organize-your-bookmarks,Use bookmark folders to organize your bookmarks
update-failed-error-message-when-updating,How to fix the Update Failed error message when updating Firefox
restore-default-smart-bookmarks-folders,Restore the default Smart Bookmarks Folders
configure-windows-firewall-allow-firefox-access,How to let Firefox use the internet on your Windows computer
how-do-i-delete-bookmark,How do I delete a bookmark?
firefox-takes-long-time-start-up,Firefox takes a long time to start up
search-firefox-address-bar,Search with the Firefox address bar
what-to-do-if-firefox-wont-play-any-sounds,What to do if Firefox won't play any sounds
control-whether-firefox-automatically-fills-forms,Control whether Firefox automatically fills in forms
block-and-unblock-websites-parental-controls-firef,Block and unblock websites with parental controls on Firefox
disable-or-remove-add-ons,Disable or remove Add-ons
restore-bookmarks-passwords-and-data-from-an-old-firefox-profile,"Restore bookmarks, passwords, and data from an old Firefox profile"
troubleshoot-and-diagnose-firefox-problems,Troubleshoot and diagnose Firefox problems
how-to-fix-preferences-wont-save,How to fix preferences that won't save
cannot-remove-add-on-extension-or-theme,Cannot remove an add-on (extension or theme)
unable-install-add-ons-extensions-or-themes,Unable to install add-ons (extensions or themes)
firefox-hangs-or-not-responding,Firefox hangs or is not responding - How to fix
pop-blocker-settings-exceptions-troubleshooting,"Pop-up blocker settings, exceptions and troubleshooting"
reset-preferences-fix-problems,Reset Firefox preferences to troubleshoot and fix problems
import-bookmarks-html-file,Import Bookmarks from an HTML file
uninstall-firefox-from-your-computer,Uninstall Firefox from your computer
import-bookmarks-and-other-data-microsoft-edge,Import Bookmarks and other data from Microsoft Edge
create-desktop-shortcut-website,Create a desktop shortcut to a website
sort-bookmarks-quickly-find-ones-you-want,Sort your bookmarks to quickly find the ones you want
use-primary-password-protect-stored-logins,Use a Primary Password to protect stored logins and passwords
how-do-i-tell-if-my-connection-is-secure,How do I tell if my connection to a website is secure?
firefox-options-preferences-and-settings,"Change Firefox options, preferences and settings"
cookies-information-websites-store-on-your-computer,Cookies - Information that websites store on your computer
remove-websites-address-bar-suggestions,Remove websites from the address bar suggestions
address-bar-autocomplete-firefox,Address bar autocomplete suggestions in Firefox
categorizing-bookmarks-make-them-easy-to-find,Bookmark Tags - Categorize bookmarks to make them easy to find
changes-toolbars-and-window-sizes-are-not-saved,Changes to toolbars and window sizes are not saved
install-older-version-firefox,Install an older version of Firefox
how-stop-firefox-making-automatic-connections,How to stop Firefox from making automatic connections
troubleshoot-firefox-issues-caused-malware,Troubleshoot Firefox issues caused by malware
diagnose-firefox-issues-using-troubleshoot-mode,Use Troubleshoot Mode in Firefox
troubleshoot-extensions-themes-to-fix-problems,"Troubleshoot extensions, themes and hardware acceleration issues to solve common Firefox problems"
usernames-and-passwords-are-not-saved,Usernames and passwords are not saved
mozillacrashreporter,Mozilla Crash Reporter
find-and-install-add-ons-add-features-to-firefox,Find and install add-ons to add features to Firefox
find-what-version-firefox-you-are-using,Find what version of Firefox you are using
third-party-cookies-firefox-tracking-protection,Third-party cookies and Firefox tracking protection
clear-cookies-and-site-data-firefox,Clear cookies and site data in Firefox
block-websites-storing-cookies-site-data-firefox,Block websites from storing cookies and site data in Firefox
change-program-used-open-email-links,Change the program used to open email links
cant-download-or-save-files,What to do if you can't download or save files
firefox-and-other-browsers-cant-load-websites,Firefox and other browsers can't load websites
back-and-restore-information-firefox-profiles,Back up and restore information in Firefox profiles
websites-show-spinning-wheel-never-finish-load,Websites show a spinning wheel and never finish loading
restore-previous-session,Restore previous session - Configure when Firefox shows your most recent tabs and windows
re-enable-add-ons-disabled-when-updating,Re-enable add-ons that were disabled when updating Firefox
export-firefox-bookmarks-to-backup-or-transfer,Export Firefox bookmarks to an HTML file to back up or transfer bookmarks
how-install-firefox-windows,How to install Firefox on Windows
install-firefox-linux,Install Firefox on Linux
password-manager-remember-delete-edit-logins,"Password Manager - Remember, delete and edit logins and passwords in Firefox"
update-firefox-latest-release,Update Firefox to the latest release
change-firefox-behavior-when-open-file,Manage file types and download actions in Firefox
restore-bookmarks-from-backup-or-move-them,Restore bookmarks from backup or move them to another computer
bookmarks-firefox,Bookmarks in Firefox
how-print-web-pages-firefox,How to print web pages in Firefox
warning-unresponsive-script,Warning Unresponsive script - What it means and how to fix it
firefox-cant-load-websites-other-browsers-can,Firefox can't load websites but other browsers can
how-clear-firefox-cache,How to clear the Firefox cache
firefox-doesnt-save-web-form-entries,Firefox doesn't save web form entries
make-firefox-your-default-browser,Make Firefox your default browser
how-do-i-use-firefox-spell-checker,How do I use the Firefox spell checker?
websites-dont-load-troubleshoot-and-fix-errors,Websites don't load - troubleshoot and fix error messages
customize-firefox-controls-buttons-and-toolbars,"Customize Firefox controls, buttons and toolbars"
view-pdf-files-firefox-or-choose-another-viewer,View and edit PDF files using Firefox’s built-in viewer
fix-problems-facebook-games-chat-and-more,"Fix problems with Facebook games, chat and more"
setting-firefox-default-browser-does-not-work,Setting Firefox as the default browser does not work - What to do
using-pontoon-localize-sumo,Using Pontoon to Localize SUMO
profile-manager-create-remove-switch-firefox-profiles,"Profile Manager - Create, remove or switch Firefox profiles"
use-themes-change-look-of-firefox,Use themes to change the look of Firefox
firefox-wont-start-find-solutions,Firefox won't start - find solutions
recover-lost-or-missing-bookmarks,Recover lost or missing Bookmarks
adding-screencasts,Add screencasts to Knowledge Base articles
send-plugin-crash-reports-help-improve-firefox,Send plugin crash reports to help Mozilla improve Firefox
server-not-found-connection-problem,Server Not Found - Troubleshoot connection problems
firefox-says-its-just-updated-every-time-it-starts,Firefox says it's just updated every time it starts - how to fix
Certificate-contains-the-same-serial-number-as-another-certificate,Certificate contains the same serial number as another certificate
how-to-set-the-home-page,How to set the home page
delete-browsing-search-download-history-firefox,"Delete browsing, search and download history on Firefox"
how-contribute-article-localization,How to contribute to article localization
export-bookmarks-safari,Export bookmarks to Safari
how-download-and-install-firefox-mac,How to download and install Firefox on Mac
websites-say-cookies-are-blocked-unblock-them,Websites say cookies are blocked - Unblock them
accessibility-features-firefox,Accessibility features in Firefox - Make Firefox and web content work for all users
where-find-and-manage-downloaded-files-firefox,Where to find and manage downloaded files in Firefox
mouse-shortcuts-perform-common-tasks,Use mouse shortcuts to perform common tasks in Firefox
tabs-organize-websites-single-window,Use tabs to organize lots of websites in a single window
font-size-and-zoom-increase-size-of-web-pages,Font size and zoom - increase the size of web pages
audio-and-video-firefox,Audio and video files in Firefox
tab-preferences-and-settings,Tab preferences and settings
fix-login-issues-on-websites-require-passwords,Fix login issues on websites that require a username and password
search-contents-current-page-text-or-links,How to search the contents of the current page for text or links
use-troubleshooting-information-page-fix-firefox,Use the Troubleshooting Information page to help fix Firefox issues
keyboard-shortcuts-perform-firefox-tasks-quickly,Keyboard shortcuts - Perform common Firefox tasks quickly
get-started-firefox-overview-main-features,Get started with Firefox - An overview of the main features
firefox-does-not-work-common-fixes,Firefox does not work - Common fixes to get you back up and running
quick-fixes-if-your-firefox-slows-down,Quick fixes if your Firefox slows down
mozilla-support-rules-guidelines,Mozilla Support rules and guidelines
install-firefox-android-device-using-google-play,Install Firefox on an Android device using Google Play
find-and-install-add-ons-firefox-android,Find and install extensions on Firefox for Android
fix-bookmarks-and-history-will-not-be-functional,"Fix ""The bookmarks and history system will not be functional"" error message"
javascript-settings-for-interactive-web-pages,JavaScript settings and preferences for interactive web pages
how-do-i-restore-my-tabs-last-time,How do I restore my tabs from last time?
private-browsing-use-firefox-without-history,Private Browsing - Use Firefox without saving history
firefox-already-running-not-responding,"""Firefox is already running but is not responding"" error - How to fix"
clear-recent-searches-search-bar,Clear recent searches from the Search bar
restore-menu-bar-firefox,Restore the Menu bar in Firefox
contributor-news-resources,Contributor News & Resources
fix-problems-connecting-websites-after-updating,Fix problems connecting to websites after updating Firefox
configure-firewalls-so-firefox-can-access-internet,Configure firewalls so that Firefox can access the Internet
profiles-where-firefox-stores-user-data,"Profiles - Where Firefox stores your bookmarks, passwords and other user data"
improve-knowledge-base,Improve the Knowledge Base
writing-guide-knowledge-base-articles,Writing guide for Knowledge Base articles
pinned-tabs-keep-favorite-websites-open,Pinned Tabs - keep favorite websites open and just a click away
about-knowledge-base,About the Knowledge Base
localize-sumo-interface,How to localize the SUMO interface
how-to-use-for,"How to use ""For"" tags"
using-templates,Using Templates
how-do-i-set-sync-my-computer,How do I set up Sync on my computer?
meet-team,Meet the Team
how-do-i-turn-do-not-track-feature,How do I turn on the Do Not Track feature?
upgrade-graphics-drivers-use-hardware-acceleration,Upgrade your graphics drivers to use hardware acceleration and WebGL
disable-firefox-sync-lost-phone-or-tablet,Disable Firefox Sync on a lost phone or tablet
how-do-i-choose-what-information-sync-firefox,How do I choose what information to sync on Firefox?
ive-lost-my-firefox-sync-account-information,I've lost my Firefox Sync account information - What to do
refresh-firefox-reset-add-ons-and-settings,Refresh Firefox - reset add-ons and settings
change-default-language-firefox-android,Change the default language of Firefox for Android
use-gestures-in-firefox-android,Use gestures in Firefox for Android
how-firefox-android-use-permissions-it-requests,How does Firefox for Android use the permissions it requests?
helping-crashes,Helping with crashes
article-review-guidelines,Article review and approval guidelines
how-make-firefox-and-websites-go-full-screen,Use Firefox in Full Screen mode
how-do-i-create-screenshot-my-problem,How do I create a screenshot of my problem?
clear-your-browsing-history-and-other-personal-data,Clear your browsing history and other personal data on Firefox for Android
how-can-i-help-submitting-mobile-performance-data,How can I help by submitting mobile performance data?
remove-toolbar-has-taken-over-your-firefox-search,Remove a toolbar that has taken over your Firefox search or home page
how-do-i-share-firefox-between-people-on-computer,How do I share Firefox between people on a computer?
what-mozilla-maintenance-service,What is the Mozilla Maintenance Service?
customize-items-on-firefox-new-tab-page,Customize items on your Firefox New Tab page
how-do-i-change-desktop-view-firefox-android,How do I change to the desktop view in Firefox for Android?
technical-writing-program,Technical writing program
where-are-my-logins-stored,Where are my logins stored?
how-stay-safe-web,How to stay safe on the web
when-and-how-to-use-keywords,When and how to use keywords to improve an article's search ranking
anatomy-of-a-knowledge-base-article,Anatomy of a Knowledge Base article
create-new-knowledge-base-article,Create a new Knowledge Base article
markup-cheat-sheet,Markup cheat sheet
firefox-available-iphone-or-ipad-my-language,Is Firefox available for iPhone or iPad in my language?
how-participate-sumo-contributor-meetings,How to participate in SUMO contributor meetings
how-to-make-screenshots,How to make screenshots
mixed-content-blocking-firefox,Mixed content blocking in Firefox
using-dark-theme-firefox-android,Using Dark Theme in Firefox for Android
private-browsing-firefox-android,Private Browsing on Firefox for Android
how-do-i-quit-firefox-android,How do I quit Firefox for Android?
research-upcoming-changes-firefox,Research upcoming changes to Firefox
how-do-i-share-things-firefox-android,How do I share things from Firefox for Android?
how-does-phishing-and-malware-protection-work,How does built-in Phishing and Malware Protection work?
a-guide-to-linking-to-support-articles,A guide to linking to support articles
how-translate-sumo-kb-articles-hindi,How to Translate SUMO KB Articles in Hindi
share-your-android-device-firefox-guest-session,Share your Android device with a Firefox Guest Session
how-place-images-article,Add images and screenshots to Knowledge Base articles
secure-website-certificate,Secure website certificate
how-translate-sumo-kb-articles-bengali,How to translate SUMO KB articles in Bengali
signatures,Signatures
global-search,Global Search
quick-filter-toolbar,Quick Filter Toolbar
manual-account-configuration,Manual Account Configuration
faq-changing-imap-pop,FAQ Changing IMAP to POP
archived-messages,Archived Messages
automatic-account-configuration,Automatic Account Configuration
keyboard-shortcuts-thunderbird,Keyboard shortcuts - perform common Thunderbird tasks quickly
profiles-where-thunderbird-stores-user-data,Profiles - Where Thunderbird stores your messages and other user data
troubleshoot-mode-thunderbird,Troubleshoot Mode Thunderbird
thunderbird-and-gmail,Thunderbird and Gmail
changing-imap-pop,Changing IMAP to POP
mozilla-crash-reporter-tb,Mozilla Crash Reporter TB
creating-newsgroup-account,Creating a Newsgroup Account
thunderbird-and-hotmail,Thunderbird and Hotmail
thunderbird-and-comcast,Thunderbird and Comcast
imap-synchronization,IMAP Synchronization
cannot-receive-messages,Cannot receive messages
thunderbird-crashes,Thunderbird Crashes
updating-thunderbird,Update Thunderbird to the latest version
thunderbird-faq,Thunderbird FAQ
thunderbird-software-update-failed,Thunderbird Software Update Failed
how-disable-or-change-thunderbird-start-page,How to disable or change the Thunderbird start page
thunderbird-and-sympatico,Thunderbird and Sympatico
using-identities,Using Identities
thunderbird-add-ons-frequently-asked-questions,Thunderbird add-ons - frequently asked questions
thunderbird-and-yahoo,Thunderbird and Yahoo
cannot-send-messages,Cannot send messages
switching-thunderbird,Switching to Thunderbird
installing-thunderbird-linux,Install Thunderbird on Linux
installing-thunderbird-on-mac,Install Thunderbird on Mac
keyboard-shortcuts-searching,Keyboard Shortcuts for Searching
compacting-folders,Compacting folders
moving-thunderbird-data-to-a-new-computer,Move Thunderbird data to a new computer
names-bug-no-email-addresses-are-displayed,Names but no Email Addresses are Displayed
hyperlinks-in-messages-not-working,Hyperlinks in messages do not work
protect-your-thunderbird-passwords-primary-password,Protect your Thunderbird passwords with a Primary Password
adding-a-holiday-calendar,Adding a holiday calendar
changing-calendar-preferences,Changing calendar preferences
make-thunderbird-default-mail-client,Make Thunderbird the Default Mail Client
lightning-user-interface,Lightning User Interface
using-lightning-google-calendar,Using Thunderbird with Google Calendar
configuring-lightning,Configuring Lightning
working-events,Work with events
creating-a-new-event-or-task,Create a new event or task
exporting-and-sharing-a-calendar,Export and share a calendar
changing-date-or-time-event,Change the date or time of an event
inviting-other-people-events,Inviting Other People to Events
creating-a-recurring-event,Create a recurring event
creating-new-calendars,Create new calendars
message-list-columns,Message List Columns
vacation-response,Vacation Response
using-multiple-profiles,Use multiple profiles in Thunderbird
configuration-options-accounts,Configuration Options for Accounts
configuration-options-identity,Configuration Options for Identity
configuration-options-attachments,Configuration Options for Attachments
thunderbird-makes-unrequested-connections,Thunderbird makes unrequested connections
how-use-virtual-card-vcard,How to use a Virtual Card (vCard)
how-can-i-send-large-attachment,How can I send a large attachment?
thunderbird-and-att,Thunderbird and AT&T
config-editor,Config Editor
blocking-sender,Blocking a sender
how-use-attachments,How to Use Attachments
rebuilding-global-database,Rebuilding the Global Database
what-winmaildat-attachment,What is the winmail.dat attachment?
switching-folder-pane-view,Switching the folder pane view
how-install-and-use-another-language-dictionary-th,How to Install and Use another Language in the Dictionary on Thunderbird
glossary-terms-including-types-accounts,Glossary of Terms including types of Accounts
installing-thunderbird-windows,Install Thunderbird on Windows
open-search,Open Search
add-search-engine-open-search,Add Search Engine to Open Search
thunderbird-and-junk-spam-messages,Thunderbird and Junk / Spam Messages
filelink-large-attachments,Filelink for Large Attachments
digitally-signing-and-encrypting-messages,Digitally Signing and Encrypting Messages
new-email-address,New Email Address
thunderbirds-scam-detection,Thunderbird’s Scam Detection
using-saved-searches,Using Saved Searches
sending-and-receiving-messages-thunderbird,Send and receive messages in Thunderbird
how-customize-new-mail-sound,How to Customize the New Mail Sound
organize-your-messages-using-filters,Organize your messages with filters
how-subscribe-news-feeds-and-blogs,How to Subscribe to News Feeds and Blogs
switch-pop-imap-account,Switch from POP to IMAP account
instant-messaging-and-chat,Instant Messaging and Chat
addressing-email,Addressing an Email
how-customize-toolbars,How to Customize Toolbars
display-thunderbird-menus-and-toolbar,Display the Thunderbird menus and toolbar
ignore-threads,Ignoring threads
localization-dashboard,Localization Dashboards
about-new-tab-page,New Tab page in Firefox
l10n-guidelines-reviewing-translated-articles,L10N guidelines for reviewing translated articles
uninstall-thunderbird,Uninstall Thunderbird from your computer
how-be-sumo-locale-leader,How to be a SUMO Locale Leader
what-badge,What is a badge?
why-open-badges,Why Open Badges?
mozillas-open-badges-project,What is Mozilla's Open Badges project?
what-open-badges-infrastructure,What is the Open Badges Infrastructure?
open-badges-research,Is there Open Badges research available?
what-mozilla-badgekit,What is Mozilla BadgeKit?
why-did-we-create-mozilla-badgekit,Why did we create Mozilla BadgeKit?
what-included-badgekit,What is included in BadgeKit?
badgekit-ready-now,Is BadgeKit ready now?
badgekit-who,Who is BadgeKit for?
technical-documentation-badgekit,Where is technical documentation for BadgeKit?
what-is-a-mozilla-backpack,What is a Mozilla Backpack?
where-can-i-earn-badges,Where can I earn badges?
how-do-i-share-badges-ive-earned,How do I share the badges I've earned?
are-all-my-badges-public,Are all my badges public?
how-do-i-become-issuer,How do I become an issuer?
what-badgekit,What is BadgeKit?
who-else-issuing-open-badges,Who else is issuing Open Badges?
where-can-i-go-technical-help,Where can I go for technical help?
how-can-i-personally-display-open-badges,How can I personally display Open Badges?
organization-displayer-open-badges,How does my organization become a displayer of Open Badges?
contributors-guide-writing-good-bug,Contributors guide for writing a good bug
add-support-guidelines-contributors,Extension support guidelines for contributors
where-can-i-go-open-badges-support,Where can I go for Open Badges support?
remote-content-in-messages,Remote Content in Messages
how-reset-default-user-agent-firefox,How to reset the default user agent on Firefox
update-latest-version-firefox-android,Update to the latest version of Firefox for Android
firefox-support-troubleshooting-guide,Firefox Support troubleshooting guide
moderation-guidelines,Forum Moderation Guidelines
use-firefox-sidebar-access-bookmarks-history-synced,"Use the Firefox Sidebar to access bookmarks, history and synced tabs"
cannot-delete-messages,Cannot delete messages
how-add-shortcut-website-android,Create a shortcut to a website on Firefox for Android
im-having-problems-confirming-my-firefox-account,I'm having problems confirming my Mozilla account
use-firefox-another-language,Use Firefox in another language
where-go-developer-support,Where to go for developer support
access-mozilla-services-firefox-account,Access Mozilla services with a Mozilla account
firefox-android-support-forum-contributors,Firefox for Android for Support Forum Contributors
angry-user-training,Angry User Training
frequently-asked-questions,Frequently Asked Questions
forget-button-quickly-delete-your-browsing-history,Forget button - quickly delete your browsing history on Firefox
firefox-crashes-asking-support,Firefox crashes - asking for support
navigate-support-forum-platform,How to navigate and use the support forum platform
customer-service-contributor-forum-skills,Customer Service Contributor Forum Skills
get-help-firefox-developer-edition,Get help with Firefox Developer Edition
manage-my-default-search-engines-firefox-android,Manage my default search engines in Firefox for Android
how-create-and-use-mailing-lists-thunderbird,How to create and use mailing lists on Thunderbird
enhanced-tracking-protection-firefox-android,Enhanced Tracking Protection in Firefox for Android
create-or-improve-common-forum-responses,Create or improve common forum responses
uninstall-firefox-android-add-ons,Uninstall Firefox for Android extensions
uninstall-firefox-android,Uninstall Firefox for Android
how-does-support-localization-work,How does support localization work?
translating-an-article,Translating an article
how-do-i-update-articles-after-their-first-translation,How do I update articles after their first translation?
enable-drm,Watch DRM content on Firefox
firefox-reader-view-clutter-free-web-pages,Firefox Reader View for clutter-free web pages
clear-your-browsing-history-firefox-android,Clear your browsing history in Firefox for Android
open-h264-plugin-firefox,Why is there an OpenH264 plugin in Firefox?
what-search-hijacking,What is search hijacking?
add-on-signing-in-firefox,Add-on signing in Firefox
how-add-remove-edit-and-move-bookmarks-firefox-ios,"How to add, remove, edit and move bookmarks in Firefox for iOS"
share-pages-firefox-other-browsers,Share pages with Firefox from other browsers
change-your-default-search-engine-firefox-ios,Change your default search engine in Firefox for iOS
practice-article-localize-this,Practice article for SUMO localizers (localize this)
installing-addon-thunderbird,Installing an Add-on in Thunderbird
maildir-thunderbird,Maildir in Thunderbird
avoid-and-report-mozilla-tech-support-scams,Avoid and report Mozilla tech support scams
web-pages-arent-displaying-properly-firefox-androi,Web pages aren't displaying properly in Firefox for Android
rate-your-firefox-experience-heartbeat,"Rate your Firefox experience, surveys and out of date messages (Heartbeat)"
add-or-remove-search-engine-firefox,Add or remove a search engine in Firefox
