slug,title
install-firefox-your-phone-or-tablet,Install Firefox on your phone or tablet
about-config-editor-firefox,Configuration Editor for Firefox
how-change-your-default-browser-firefox-windows,Make Firefox your default browser on Windows
thunderbird-and-logjam,Thunderbird and Logjam
search-suggestions-firefox,Search suggestions in Firefox
clear-browsing-history-firefox-ios,Clear browsing history in Firefox for iOS
enable-or-disable-search-engines-firefox-ios,Enable or disable search engines on Firefox for iOS
view-web-pages-reader-view-firefox-ios,View web pages in Reader View
add-web-pages-your-reading-list-firefox-ios,Add web pages to your Reading List on Firefox for iOS
install-firefox-your-ipad-iphone-or-ipod,"Install Firefox on your iPad, iPhone or iPod"
use-tabs-firefox-ios,Use tabs in Firefox for iOS
what-version-firefox-do-i-have-ios,Which version of Firefox am I using?
sync-bookmarks-tabs-history-and-passwords-android,"Sync bookmarks, tabs, history, and passwords on Android"
sync-bookmarks-logins-and-browsing-history-firefox,"Sync bookmarks, logins and browsing history on Firefox for iOS"
navigation-bar-firefox-ios,Navigation bar in Firefox for iOS
uninstall-firefox-ios,Uninstall Firefox for iOS
thunderbird-accessibility-features,Thunderbird Accessibility Features
manage-saved-login-information,Manage saved passwords in Firefox for Android
customize-firefox-home-ios,Customize Firefox Home on iOS
whats-new-august-31-2015-release,"What's new in the August 31, 2015 release?"
customize-firefox-home-screen,Customize the Firefox home screen
change-your-default-search-settings-firefox,Manage Firefox search settings
copy-saved-password-firefox-android,Copy a saved password in Firefox for Android
private-browsing-firefox-ios,About private browsing in Firefox for iOS
scan-qr-codes-firefox-android,Scan QR codes in Firefox for Android
voice-input-firefox-android,Voice input in Firefox for Android
mute-sound-firefox-tabs,Mute sound in Firefox tabs
site-information-panel,Site Information panel
sumo-living-localization-guide,SUMO Living Localization Guide
insecure-password-warning-firefox,Insecure connection password warning in Firefox
im-having-problems-my-firefox-account,I'm having problems with my Mozilla account
push-notifications-firefox,Web Push notifications in Firefox
firefox-focus-ios,What is Firefox Focus for iOS?
firefox-no-longer-available-download-t-store,Firefox is no longer available for download in the T-Store
what-does-your-connection-is-not-secure-mean,What do the security warning codes mean?
change-default-language-firefox-ios,Change the default language on Firefox for iOS
set-firefox-default-browser-ios,Set Firefox as the default browser for iOS
identify-noisy-tabs-firefox-android,Identify noisy tabs in Firefox for Android
fxa-managing-devices,Manage the devices linked to your Mozilla account
viewing-desktop-sites-firefox-ios,Viewing Desktop Sites on Firefox iOS
accessibility-and-ppt,Accessibility not available during multi-process support
send-text-or-multimedia-messages-firefox-android,Send text or multimedia messages from Firefox for Android
get-latest-version-thunderbird-windows-xp-vista,How can I get the latest version of Thunderbird on Windows XP or Vista?
search-within-web-page-firefox-ios,Search within a web page in Firefox for iOS
manage-saved-passwords-firefox-ios,Manage saved passwords in Firefox for iOS
error-codes-secure-websites,Troubleshoot security error codes on secure websites
staging-site,Staging Site
article-history,Article History
edit-knowledge-base-article,Edit a Knowledge Base article
article-description,Article Description
what-firefox-klar-ios,What is Firefox Klar for iOS?
how-do-i-tell-if-32-bit-or-64-bit,How do I tell if I have the 32-bit or 64-bit Firefox?
access-your-add-ons-firefox-accounts,Access your add-ons with a Mozilla account
article-discussion-forums,Article discussion forums
whats-new-firefox-android,What's new in Firefox for Android
article-status-and-change-type,Article status and change type
view-synced-tabs-other-devices,View synced tabs from other devices
using-knowledge-base-dashboard,Using the Knowledge Base Dashboard
set-passcode-and-touch-id-firefox,Set up a passcode and Face ID in Firefox for iOS
change-your-firefox-accounts-password,Change your Mozilla account password
suspicious-activity-my-firefox-account,Suspicious activity on my Mozilla account
troubleshoot-time-errors-secure-websites,Troubleshoot time-related errors on secure websites
add-firefox-today-view-your-ios-device,Add Firefox to the Today view on your iOS device
certificate-warnings-firefox-ios,Certificate warnings in Firefox for iOS
re-enable-multi-process-disabled-windows-utilities,Re-enable multi-process support disabled by Windows utilities
automatically-close-private-tabs-when-leaving-priv,Keep Private Browsing tabs open after exiting Firefox
set-homepage-firefox-ios,Set a homepage in Firefox for iOS
keyboard-shortcuts-firefox-ios,Keyboard shortcuts in Firefox for iOS
containers,Multi-Account Containers
i-found-fake-firefox-update,I found a fake Firefox update
add-ons-firefox-ios,Add-ons in Firefox for iOS
screenshare-safety,Share browser windows or your screen with sites you trust
using-primary-password-sync,Use a Primary Password with Sync
accounts-blocked,My sign in was blocked for security reasons on Mozilla account
message-tags,Message Tags - Categorize your email in Thunderbird
change-default-email-program-firefox-ios,Change the default email program in Firefox for iOS
npapi-plugins,"Why do Java, Silverlight, Adobe Acrobat and other plugins no longer work?"
end-support-windows-xp-and-vista,Firefox has ended support for Windows XP and Vista
advanced-panel-settings-in-thunderbird,"Advanced panel - System, network, updates, and other advanced settings in Thunderbird"
change-default-search-firefox-focus-ios,Change the default search in Firefox Focus on iOS
what-firefox-focus-android,What is Firefox Focus for Android?
set-firefox-focus-default-browser-android,Set Firefox Focus as default browser on Android
your-hardware-no-longer-supported-tb,Your hardware is no longer supported by Thunderbird
some-videos-wont-play-background,Some videos won't play in background
change-your-default-search-firefox-focus-android,Change your default search on Firefox Focus for Android
performance-settings,Firefox's performance settings
view-mobile-bookmarks-your-computer,View mobile bookmarks on your computer
firefox-focus-android-frequently-asked-questions,Firefox Focus for Android - Frequently asked questions
set-firefox-klar-your-default-browser-android,Set Firefox Klar as your default browser on Android
what-firefox-klar-android,What is Firefox Klar for Android?
change-your-default-search-firefox-klar-android,Change your default search on Firefox Klar for Android
firefox-klar-android-frequently-asked-questions,Firefox Klar for Android - Frequently asked questions
change-the-default-search-in-firefox-klar-on-ios,Change the default search in Firefox Klar on iOS
how-do-i-delete-my-firefox-account,How do I delete my Mozilla account?
storage,Manage local site storage settings
difference-between-firefox-focus-and-firefox-klar,"I can't find Firefox Focus in Germany, Austria or Switzerland"
64-bit-firefox-crashes-citrixs-xenapp-vm,64-bit Firefox crashes with Citrix's XenApp VM
take-screenshots-firefox,Take screenshots in Firefox
best-practices-answering-questions-support-forum,Best practices for answering questions in the Support Forum - Edits welcome!
scan-qr-codes-firefox-ios,Scan QR codes in Firefox for iOS
night-mode-firefox-ios,Website Dark Mode in Firefox for iOS
hide-images-firefox-ios,Hide Images in Firefox for iOS
send-tab-firefox-ios-another-device,Send a tab from Firefox for iOS to another device
thunderbird-osx,"Thunderbird support has ended for Mac OS X 10.6, 10.7 and 10.8"
attnadmin-how-community-can-reach-admin-and-when,[Attn Admin] How the community can reach an Admin and when you might want to
change-primary-email-address-firefox-accounts,Change the primary email address on your Mozilla account
how-update-add-ons,How to update add-ons
built-themes-firefox-alternative-complete-themes,Built-in themes in Firefox - alternative to complete themes
shield,About Studies
message-threading-thunderbird,Message threading in Thunderbird - keep messages grouped by conversation
automatically-fill-your-address-web-forms,Automatically fill in your address on web forms
open-new-private-tab-firefox-focus-android,Open a new private tab in Firefox Focus for Android
open-new-tab-firefox-klar,Open a new private tab in Firefox Klar
enhanced-tracking-protection-firefox-ios,Enhanced Tracking Protection in Firefox for iOS
i-cant-play-audio-remote-desktop-connection,I can’t play audio on a Remote Desktop Connection
set-firefox-lite-your-default-browser,Set Firefox Lite as your default browser
firefox-lite-turbo-mode,Firefox Lite Turbo Mode
capture-screenshots-using-firefox-lite,Capture screenshots using Firefox Lite
browse-faster-blocking-images-firefox-lite,Browse faster by blocking images in Firefox Lite
screenshots-problem-firefox-lite,I can't take screenshots of some websites on Firefox Lite
get-started-firefox-lite,Get started with Firefox Lite
clear-cache-without-clearing-browsing-history,Clear your cache without clearing your browsing history
connection-settings-firefox,Connection settings in Firefox
add-web-page-shortcuts-your-home-screen,Add web page shortcuts to your Home screen
add-search-bar-firefox-toolbar,Add the Search bar to your Firefox toolbar
microcode-update,Updating processor microcode
broadwell-u-microcode,Crash on Broadwell-U with old microcode
can-i-use-my-screen-reader-new-firefox,Can I use my screen reader with the new Firefox?
turn-search-suggestions-or-firefox-ios,Turn search suggestions on or off on Firefox for iOS
switching-chrome-firefox,Switch from Chrome to Firefox
tracking-protection-focus-ios,Tracking Protection on Firefox Focus for iOS
extension-changed-my-new-tab-page,An extension changed my New Tab page or home page
remove-search-engine-firefox-focus-android,Remove a search engine in Firefox Focus for Android
add-search-engine-firefox-focus-android,Add a search engine to Firefox Focus for Android
autocomplete-settings-firefox-focus-address-bar,Autocomplete settings in the Firefox Focus address bar
autocomplete-url-bar-firefox-focus-ios,Autocomplete web addresses in the URL bar in Firefox Focus for iOS
add-search-engines-firefox-focus-ios,Add search engines in Firefox Focus for iOS
remove-search-engine-firefox-focus-ios,Remove a search engine in Firefox Focus for iOS
print-simplified-clutter-free-pages-firefox,"Print simplified, clutter-free pages in Firefox"
manage-bookmark-folders-firefox-android,Manage bookmark folders in Firefox for Android
enable-email-invitations-caldav-servers-configured,Enable email invitations for CalDAV servers configured to do serverside scheduling
utf-8-only-file-paths,File system paths on Linux are always treated as UTF-8
does-firefox-share-my-location-websites,Does Firefox share my location with websites?
tips-assessing-safety-extension,Tips for assessing the safety of an extension
permission-request-messages-firefox-extensions,About permission request messages for Firefox extensions
security-panel-settings-in-thunderbird,"Security panel - Junk, scam, antivirus, and password settings in Thunderbird"
privacy-panel-settings-in-thunderbird,Privacy panel - Remote content and cookie settings in Thunderbird
find-what-version-thunderbird-you-are-using,Find what version of Thunderbird you are using
password-manager-remember-delete-change-tb,"Password Manager - Remember, delete and change passwords in Thunderbird"
videos-dont-have-sound-citrix,Videos don't have sound on Citrix
how-add-translate-feature-firefox,How to add the translate add-on to Firefox
firefox-protection-against-fingerprinting,Firefox's protection against fingerprinting
add-secondary-email-address-firefox-accounts,Add a secondary email address to Mozilla accounts
how-replace-google-assistant-firefox-search,How to replace Google Assistant with a Firefox search
privacy-web-authentication,Protect privacy while using Web Authentication
reorder-tabs-tab-view,Reorder tabs from tab view
drag-and-drop-links-and-tabs-and-firefox,Drag and drop links and tabs to and from Firefox
add-shortcuts-websites-your-home-screen,Add shortcuts to websites on your home screen
open-and-switch-multiple-websites-multi-tabs,Open and switch between multiple websites (multi-tab)
facebook-container-isnt-working,Facebook Container isn't working
how-facebook-container-different-multi-account-con,How is Facebook Container different from Multi-account Containers?
firefox-4k-ultra-high-definition-youtube-videos,Playing 4K (Ultra-High Definition) YouTube videos in Firefox
secure-firefox-account-two-step-authentication,Set up two-factor authentication on your Mozilla account
thunderbird-end-support-xp-and-vista,Thunderbird end of Support for XP and Vista
repackaging-windows-installer,Repackage the Windows installer
block-cookies-firefox-focus-android,Block cookies in Firefox Focus for Android
block-cookies-firefox-klar-android,Block cookies in Firefox Klar for Android
choosing-firefox-update-channel,Choose a Firefox update channel
customizing-firefox-using-autoconfig,Customize Firefox using AutoConfig
customizing-firefox-using-group-policy-windows,Customize Firefox using Group Policy (Windows)
customizing-firefox-using-policiesjson,Customize Firefox using policies.json
deploying-firefox-customizations-macos,Deploy Firefox customizations on macOS
access-hidden-tabs-firefox,Access hidden tabs in Firefox
download-photos-and-files-firefox-ios,Download photos and files on Firefox for iOS
information-eu-eea-swiss-and-california-users,"Information for EU, EEA, Swiss, California, Connecticut, Virginia and Utah users"
deploying-firefox-with-extensions,Deploy Firefox with extensions
password-strength,Choose a strong password
find-words-page-firefox-focus-ios,Find words on a page in Firefox Focus for iOS
change-desktop-view-firefox-focus-ios,Change to desktop view on Firefox Focus for iOS
drag-links-and-firefox-focus,Drag links to and from Firefox Focus
drag-links-and-firefox-klar,Drag links to and from Firefox Klar
use-face-id-or-touch-id-firefox-klar,Use Face ID or Touch ID on Firefox Klar
find-words-page-firefox-klar-ios,Find words on a page in Firefox Klar for iOS
change-desktop-view-firefox-klar-ios,Change to desktop view on Firefox Klar for iOS
find-words-page-firefox-klar-android,Find words on a page in Firefox Klar for Android
find-words-page-firefox-focus-android,Find words on a page in Firefox Focus for Android
change-desktop-view-firefox-klar-android,Change to desktop view on Firefox Klar for Android
switch-desktop-view-firefox-focus-android,Switch to desktop view on Firefox Focus for Android
tables-format-messages-rows-and-columns,Tables - Format messages with rows and columns
unify-your-pop-email-accounts-global-inbox,Unify your POP email accounts with a global inbox
managing-account-data,Managing Account Data
reporting-extensions-and-themes-abuse,Report extensions and themes for abuse
bookmark-pages-firefox-lite,Bookmark pages in Firefox Lite
private-browsing-firefox-lite,Private Browsing in Firefox Lite
difference-between-imap-and-pop3,The difference between IMAP and POP3
change-themes-firefox-ios,Change themes in Firefox for iOS
calendar-updates-issues-thunderbird,Calendar updates issues with Thunderbird
reset-your-firefox-account-password-recovery-keys,Reset your Mozilla account password with Recovery Keys
firefox-starts-automatically-when-i-restart-window,Firefox starts automatically when I restart Windows
block-autoplay,Allow or block media autoplay in Firefox
feed-reader-replacements-firefox,Feed reader replacements for Firefox
remove-synced-device-firefox-accounts,Remove a synced device from your Mozilla account
report-breakage-due-blocking,How do I report a broken site in Firefox desktop?
geckoview-firefox-klar,GeckoView in Firefox Klar
search-suggestions-firefox-focus-android,Search suggestions in Firefox Focus for Android
search-suggestions-firefox-klar-android,Search suggestions in Firefox Klar for Android
screenshot-categories-firefox-lite,Screenshot categories in Firefox Lite
recommendations-firefox,Recommendations from Firefox
choosing-firefox-cpu-architecture-windows-os,Choosing a Firefox CPU architecture for Windows OS
firefox-focus-main-menu,Firefox Focus main Menu
firefox-screenshotgo-capture-organize-screenshots,Firefox ScreenshotGo - capture and organize screenshots
amo-addonsmozillaorg-managing-account-data,AMO (addons.mozilla.org) - Managing account data
bugzilla-managing-account-data,Bugzilla - Managing account data
discourse-managing-account-data,Discourse - Managing account data
mdn-managing-account-data,MDN - Managing account data
moderator-managing-account-data,Moderator - Managing account data
pontoon-managing-account-data,Pontoon - Managing account data
sumo-managing-account-data,SUMO - Managing account data
how-use-collections-addonsmozillaorg,How to use collections on addons.mozilla.org
firefox-accounts-managing-account-data,Mozilla account - Managing account data
how-do-you-use-google-firebase-firefox,How do you use Google Firebase in Firefox?
how-do-you-use-adjust-firefox,How do you use Adjust in Firefox?
live-bookmarks-migration,What happened to my Live Bookmarks?
mozilla-monitor-faq,Mozilla Monitor - Frequently asked questions
install-themes-change-look-thunderbird,Install themes to change the look of Thunderbird
safe-browsing-firefox-focus,Safe browsing in Firefox Focus
debugging-policy-issues,Debugging policy issues
search-suggestions-firefox-focus-ios,Search suggestions in Firefox Focus for iOS
personalized-extension-recommendations,Personalized extension recommendations
unable-install-add-on-extension-theme-thunderbird,Unable to install add-ons (extensions or themes) in Thunderbird
thunderbird-beta,Thunderbird Beta
firefox-sync-takes-too-long-sync-or-send-pages-ios,Firefox Sync takes too long to sync or send pages from my iPhone or iPad
common-myths-about-private-browsing,Common Myths about Private Browsing
find-words-page-firefox-lite,Find words on a page in Firefox Lite
change-firefox-lite-night-mode,Change Firefox Lite to Night Mode
windows-s-mode-wont-let-me-install-firefox,Windows in S mode won't let me install Firefox
add-trusted-websites-your-allow-list-firefox-focus,Add trusted websites to your allow list in Firefox Focus
add-trusted-sites-your-allow-list-firefox-klar,Add trusted sites to your allow list on Firefox Klar
search-suggestions-firefox-klar-ios,Search suggestions in Firefox Klar for iOS
how-use-find-page-firefox-android,How to Use Find in Page for Firefox for Android
assign-shortcuts-search-engines,Assign shortcuts to search engines
deploy-firefox-msi-installers,Deploy Firefox with MSI installers
choose-display-languages-multilingual-web-pages,Choose display languages for multilingual web pages
firefox-enterprise-vs-normal-firefox,How is Firefox for Enterprise different from normal Firefox?
managing-firefox-updates,Manage Firefox updates
what-if-im-locked-out-two-step-authentication,What if I'm locked out of Two-Step Authentication?
managing-policies-macos-desktops,Manage policies on macOS desktops
getting-started-thunderbird-main-window,Getting started with the Thunderbird main window
how-change-thunderbird-layout,How to change the Thunderbird layout
third-party-trackers,Third-party trackers
extensions-private-browsing,Extensions in Private Browsing
disable-high-contrast-mode-firefox,Disable high contrast mode in Firefox
dedicated-profiles-firefox-installation,Dedicated profiles per Firefox installation
task-manager-tabs-or-extensions-are-slowing-firefox,Task Manager - see whether tabs or extensions are slowing down Firefox
splash-accounts-managing-account-data,Splash Accounts - Managing Account Data
privacy-settings-firefox-enterprise,Privacy settings in Firefox for Enterprise
enforcing-policies-firefox-enterprise,Enforce policies on Firefox for Enterprise
deploying-firefox-windows,Deploy Firefox on Windows
install-system-add-ons-firefox-enterprise,Install system add-ons on Firefox for Enterprise
see-active-policies-firefox-enterprise,See active policies on Firefox for Enterprise
where-can-i-find-list-policies-firefox-enterprise,Where can I find a list of policies for Firefox for Enterprise?
managing-policies-linux-desktops,Managing policies on Linux desktops
where-find-release-notes-firefox-enterprise,Where to find release notes for Firefox for Enterprise
best-practices-installing-and-updating-firefox,Best practices for installing and updating Firefox
test-versions-firefox-your-organization,Test versions of Firefox for your organization
block-add-ons-firefox-enterprise,Block add-ons in Firefox for Enterprise
search-open-tabs-firefox,Search open tabs in Firefox
manage-extension-shortcuts-firefox,Manage extension shortcuts in Firefox
how-do-i-know-status-my-sync,How do I know the status of my sync?
will-policies-work-if-users-already-installed-firefox,Will policies I set work if users already installed Firefox?
setting-roaming-users-profiles,Setting Up Roaming Users Profiles
silently-install-uninstall-firefox-enterprise,How to silently install/uninstall Firefox for Enterprise
make-firefox-enterprise-default-browser,Make Firefox for Enterprise the default browser
setting-certificate-authorities-firefox,Set up Certificate Authorities (CAs) in Firefox
windows-administrator-launcher-process-error-fix,Drag and Drop errors with Firefox Launcher Process enabled and Windows UAC disabled - How to Fix
legacy-browser-support-extension-windows,Legacy browser support extension for Windows
common-voice-accounts-managing-account-data,Common Voice Accounts - Managing Account Data
review-installed-extensions,Review installed extensions
understanding-risks-unlisted-extensions,Understanding the risks of installing self-hosted extensions
best-practices-creating-new-video-tutorials,Best practices for creating new video tutorials
access-toolbar-functions-using-keyboard,Access toolbar functions using the keyboard
protect-your-container-tabs-mozilla-vpn,Protect your container tabs with Mozilla VPN
firefox-accounts-supportmozillaorg,Mozilla account on support.mozilla.org
cast-youtube-videos-firefox-fire-tv,How to cast YouTube videos on Firefox for Fire TV
cant-watch-youtube-videos-fullscreen-firefox-lite,I can’t watch YouTube videos fullscreen on Firefox Lite
recommended-extensions-program,Recommended Extensions program
how-manage-your-camera-and-microphone-permissions,How to manage your camera and microphone permissions with Firefox
send-tab-firefox-desktop-other-devices,Send Tab from Firefox desktop to other devices
send-tab-from-another-mobile-app-to-firefox,Send Tab from another mobile app to Firefox
how-firefox-securely-saves-passwords,How Firefox securely saves passwords
sync-firefox-desktop,How to perform Sync on Firefox desktop
manage-your-logins-firefox-password-manager,Manage your logins with the Firefox Password Manager
edit-or-delete-login-firefox-password-manager,Edit or delete a login with the Firefox Password Manager
add-login-firefox-password-manager,Add a login with the Firefox Password Manager
how-disable-enterprise-roots-preference,How to disable the Enterprise Roots preference
sync-logins-firefox-ios,Sync logins in Firefox for iOS
how-set-firefox-sync-firefox-android,How to set up Firefox Sync in Firefox for Android
collections-firefox,Collections in Firefox
facebook-container-prevent-facebook-tracking,Facebook Container - Prevent Facebook from tracking you on other websites
firefox-keeps-asking-me-primary-password,Firefox keeps asking me for Primary Password
recover-user-data-missing-after-firefox-update,Recover user data missing after Firefox update
sync-custom-preferences,Sync custom preferences
firefox-subprocessor-list,Firefox service providers and partners
firefox-dns-over-https,Firefox DNS over HTTPS
firefox-esr-release-cycle,Firefox ESR release cycle
unable-launch-older-version-profile,Unable to use profile when you launch an older version of Thunderbird
open-firefox-tab-windows-volume-mixer,Why is each open Firefox tab showing up in the Windows volume mixer?
turn-picture-picture-mode,Turn picture-in-picture mode controls on and off
certificate-cannot-be-trusted-warning-kazakhstan,"""Certificate cannot be trusted"" warning in Kazakhstan"
how-firefox-sync-keeps-your-data-safe-even-if-tls-fails,How Firefox Sync keeps your data safe even if TLS fails
autofill-logins-firefox,Autofill logins on Firefox
configuring-networks-disable-dns-over-https,Configure networks to disable DNS over HTTPS
enhanced-tracking-protection-firefox-desktop,Enhanced Tracking Protection in Firefox for desktop
trackers-and-scripts-firefox-blocks-enhanced-track,Trackers and scripts Firefox blocks in Enhanced Tracking Protection
firefox-browser-welcome-pages,Firefox Browser welcome pages - helping you get more from Firefox products and services
dangerous-directories-Thunderbird-account-settings,Dangerous directories
changing-your-two-step-authentication-device-firefox-account,Change your two-step authentication device for your Mozilla account
understanding-depth-profile-installation,Understanding in depth the profile per installation feature
canary-domain-use-application-dnsnet,Canary domain - use-application-dns.net
playing-videos-firefox-android,Playing videos in Firefox for Android
dns-over-https-doh-faqs,DNS over HTTPS (DoH) FAQs
firefox-password-manager-alerts-breached-websites,Firefox Password Manager - Alerts for breached websites
unable-download-files-windows-10-parental-controls,Unable to download files in Windows 10 when Parental Controls are on
customizing-firefox-macos-using-configuration-prof,Customize Firefox on macOS using configuration profiles
browsing-history-firefox,Browsing history in Firefox - View the websites you have visited
