slug,title
lightbeam-extension-firefox-no-longer-supported,Lightbeam extension for Firefox is no longer supported
firefox-enterprise-kiosk-mode,Firefox for Enterprise Kiosk mode
firefox-lite-what-vendors-do-you-use-could-receive,Firefox Lite - What vendors do you use that could receive my data?
access-popular-sites-firefox-lite,Access popular sites from Firefox Lite
clear-browsing-history-firefox-lite,Clear browsing history from Firefox Lite
access-games-firefox-lite,Access games from Firefox Lite
firefox-lite-content-and-services,Firefox Lite Content and Services
access-latest-news-firefox-lite,Access the latest news from Firefox Lite
perform-price-comparisons-firefox-lite,Perform price comparisons in Firefox Lite
access-downloads-firefox-lite,Access downloads in Firefox Lite
move-navigation-bar,Move the navigation bar to the top or bottom of the app in Firefox for Android
deploying-firefox-macos-using-pkg-and-jamf,Deploy Firefox on macOS using PKG and Jamf
disable-firefox-sync,Disable Firefox Sync
using-dark-theme-firefox-ios,Using Dark Theme in Firefox for iOS
where-are-my-synced-tabs-firefox-ios,Where are my synced tabs in Firefox for iOS?
about-picture-picture-firefox,About Picture-in-Picture in Firefox
how-download-mozilla-vpn-your-desktop-or-mobile,Download Mozilla VPN on your desktop or mobile device
how-do-i-turn-mozilla-vpn,How do I turn on Mozilla VPN?
mozilla-vpn-compatible-my-device,Is Mozilla VPN compatible with my device?
how-add-devices-your-mozilla-vpn-subscription,How to add devices to your Mozilla VPN subscription
how-do-i-choose-my-server-mozilla-vpn,How do I choose my server on Mozilla VPN?
are-there-limits-my-mozilla-vpn-connection,Are there limits to my Mozilla VPN connection?
mozilla-vpn-countries-available-subscribe,In which countries is Mozilla VPN available to subscribe?
i-forgot-my-firefox-account-password-and-i-cant-log-in-to-mozilla-vpn,I forgot my Mozilla account password and I can't sign in to Mozilla VPN
mozilla-vpn-free,Is Mozilla VPN free?
how-do-i-cancel-my-subscription-mozilla-vpn,How do I cancel my subscription to Mozilla VPN?
how-do-i-request-refund-mozilla-vpn,How do I request a refund for Mozilla VPN?
how-do-i-update-my-payment-information-mozilla-vpn,How do I update my payment information on Mozilla VPN?
debugging-mozilla-vpn,How to obtain the Mozilla VPN Logs
travel-deals-and-guides-firefox-lite,Travel deals and guides in Firefox Lite
my-privacy-settings-were-changed-custom-standard,My privacy settings were changed from Custom to Standard
webxr-permission-info-page,WebXR Permission Info Page
deceased-incapacitated-account-management-faq,Deceased or incapacitated account management FAQ
logins-sync-autofill-saving-firefox-preview,"Turn on/off saved logins, login sync and login autofill in Firefox for Android"
importing-safari-data-firefox,Importing Safari data into Firefox
how-generate-secure-password-firefox,Generate a secure password in Firefox
how-pin-and-unpin-firefox-taskbar-windows-10-and-windows-11,How to pin and unpin Firefox from the taskbar on Windows 10 and Windows 11
sync-delist,Transfer information from the old to new Firefox for Android (Nightly or Beta)
profile-manager-create-and-remove-thunderbird-profiles,Profile Manager - Create and remove Thunderbird profiles
file-bug-report-or-feature-request-mozilla,File a bug report or feature request for Mozilla products
firefox-password-authentification-prompt,Secure Firefox passwords with device sign-in
dedicated-profile-thunderbird-installation,Dedicated profile per Thunderbird installation
xframe-neterror-page,Fix error “Website will not allow Firefox to display the page.”
managing-firefox-intune,Manage Firefox with Microsoft Endpoint Manager (Intune)
compatibility-exploit-protection-windows,Compatibility with Exploit protection on Windows
run-firefox-chromeos,Run Firefox on ChromeOS
firefox-mac-osx-users-esr,"Firefox Mac OS X 10.9, 10.10 and 10.11 users move to Extended Support Release"
credit-card-autofill,Automatically fill in credit card and payment method data on Web forms
tab-context-menu,Tab context menu
export-login-data-firefox,Export login data from Firefox
mozilla-vpn-kill-switch,What is the Mozilla VPN kill switch?
introduction-to-e2e-encryption,Introduction to End-to-end encryption in Thunderbird
firefox-enterprise-78-release-notes,Firefox for Enterprise 78 - Release notes
manage-tabs-firefox-android,Manage tabs in Firefox for Android
what-happened-firefox-send,What happened to Firefox Send?
https-only-prefs,HTTPS-Only Mode in Firefox
change-firefox-lite-themes,Change Firefox Lite themes
edit-top-sites-firefox-lite-home-screen,Edit top sites on Firefox Lite home screen
primary-password-replacing-master-password,Primary Password is replacing Master Password
firefox-lite-enhanced-search-awesome-bar,Firefox Lite enhanced search with Awesome bar
whats-new-firefox-lite-version-2-5,What's new in Firefox Lite (version 2.5)
thunderbird-telemetry,Thunderbird Telemetry
managing-thunderbird-updates,Managing Thunderbird Updates
turn-push-notifications-or-firefox-ios,Turn push notifications on or off in Firefox for iOS
manage-notifications-firefox-android,Manage notifications in Firefox for Android
firefox-enterprise-79-release-notes,Firefox for Enterprise 79 - Release notes
recover-user-data-missing-after-thunderbird-update,Recover user data missing after Thunderbird update
telemetry-collection-windows-default-browser-trend,Telemetry collection - Windows default browser trends
import-login-data-file,Import login and password data from a file
firefox-android-68-and-earlier-end-support,Firefox for Android (68 and earlier) end of support
activate-firefox-relay-mask-your-email-address,Activate Firefox Relay - Mask your email address
create-email-mask-through-firefox-relay,Create an email mask through Firefox Relay
disable-email-forwarding-stop-receiving-emails-sent-through-masks,Disable email forwarding - Stop receiving emails sent through your masks
firefox-enterprise-80-release-notes,Firefox for Enterprise 80 - Release notes
downloads-firefox-android,Downloads in Firefox for Android
add-firefox-widget-your-home-screen,Add a Firefox widget to your Home screen
camera-permissions,Grant camera access to Firefox for Android
openpgp-thunderbird-howto-and-faq,OpenPGP in Thunderbird - HOWTO and FAQ
use-web-apps-firefox-android,Use Web Apps with Firefox for Android
delete-sync-data-firefox-signing-out-firefox-account,Delete sync data from Firefox by signing out of your Mozilla account
control-audio-or-video-playback-your-keyboard,Control audio or video playback with your keyboard
firefox-enterprise-81-release-notes,Firefox for Enterprise 81 - Release notes
auto-close-open-tabs-firefox-android,Auto-close open tabs in Firefox for Android
set-firefox-android-open-links-native-apps,Set Firefox for Android to open links in native apps
windows-10-warns-me-use-microsoft-verified-app,"Windows 10 warns me to use a ""Microsoft-verified"" app"
add-on-badges,About Add-on Badges
thunderbird-78-faq,Thunderbird 78 FAQ
sponsor-privacy,Sponsors on the home page and New Tab page
firefox-enterprise-82-release-notes,Firefox for Enterprise 82 - Release notes
how-send-crash-report-firefox-android,Crash reports in Firefox for Android
troubleshoot-issues-related-to-add-ons,Troubleshoot issues related to add-ons
profiling-thunderbird-performance,Profiling Thunderbird Performance
firefox-enterprise-83-release-notes,Firefox for Enterprise 83 - Release notes
end-support-adobe-flash,End of support for Adobe Flash
manage-optional-permissions-extensions,Manage optional permissions for Firefox extensions
primary-password-replacing-master-password-thunderbird,Primary Password is replacing Master Password in Thunderbird
firefox-enterprise-84-release-notes,Firefox for Enterprise 84 - Release notes
what-mozilla-vpn-and-how-does-it-work,What is Mozilla VPN and how does it work?
firefox-enterprise-85-release-notes,Firefox for Enterprise 85 - Release notes
permission-request-messages-thunderbird-extensions,Permission request messages for Thunderbird extensions
remove-other-bookmarks-folder-from-bookmarks-toolbar,Remove the Other Bookmarks folder from the Bookmarks Toolbar
mozilla-voice-server-proxy-retiring,Mozilla Voice Server Proxy Retiring
captive-portal,Captive portal detection
how-install-mozilla-vpn-linux-computer,How to install Mozilla VPN on a Linux computer
firefox-enterprise-86-release-notes,Firefox for Enterprise 86 - Release notes
end-support-firefox-amazon-devices,End of support for Firefox on Amazon Devices
report-site-issues-firefox-ios,Report Site Issues on Firefox for iOS
smartblock-enhanced-tracking-protection,SmartBlock for Enhanced Tracking Protection
firefox-enterprise-87-release-notes,Firefox for Enterprise 87 - Release notes
connecting-unsecured-networks-using-mozilla-vpn,Connecting to unsecured networks while using Mozilla VPN
firefox-ios-wont-load-web-pages,Firefox for iOS won't load web pages
no-internet-while-using-mozilla-vpn-public-wifi,Joining public WiFi while on Mozilla VPN
searching-firefox-android,Searching with Firefox for Android
what-information-does-mozilla-vpn-collect,View and control data collected by Mozilla VPN
policies-extensions-locked,Unable to uninstall add-ons (extensions or themes)
how-opt-out-studies-firefox-ios,How to opt out of studies on Firefox for iOS
how-opt-out-studies-firefox-android,How to opt out of studies on Firefox for Android
compact-mode-workaround-firefox,Compact mode workaround in Firefox
firefox-enterprise-88-release-notes,Firefox for Enterprise 88 - Release notes
how-fix-error-when-trying-open-telegram-or-slack,How to fix an error when trying to open Telegram or Slack on Firefox
text-encoding-no-longer-available-firefox-menu,Text Encoding no longer available in the Firefox menu panel
compacting-folders-potential-complications,Compacting folders - Potential complications
how-do-i-view-synced-tabs-firefox-android,How do I view synced tabs on Firefox for Android?
how-do-i-share-tab-firefox-android,How do I share a tab from Firefox for Android?
site-permissions-panel,Site Permissions panel
whats-new-firefox-ios-version-34,What's new in Firefox for iOS (version 34)
firefox-enterprise-89-release-notes,Firefox for Enterprise 89 - Release notes
end-support-firefox-lite,End of support for Firefox Lite
solutions-can-not-create-temp-folder-archive-error,"Solutions for ""Can not create temp folder archive"" error when installing Firefox (Windows 10)"
deploying-firefox-language-packs,Deploy Firefox with language packs
fritzbox-isnt-working-when-mozilla-vpn,Fritz!box isn't working when Mozilla VPN is on
firefox-enterprise-90-release-notes,Firefox for Enterprise 90 - Release notes
enable-background-updates-firefox-windows,Enable background updates on Firefox for Windows when Firefox is not running
identify-problems-third-party-modules-firefox-windows,Identify problems caused by third-party modules in Firefox for Windows
automatically-fill-credit-card-information-firefox,Automatically fill in credit card information on Firefox for Android
windows-sso,How to enable Windows SSO login in Firefox
whats-new-ios-35,What's new in Firefox for iOS (version 35)
choose-mozilla-vpn-plan-right-you,Choose the Mozilla VPN plan that is right for you
firefox-suggest,Customize Firefox Suggest settings
openpgp-recipient-alias-configuration,OpenPGP Recipient Alias Configuration
customize-date-time-formats-thunderbird,Customize Date and Time formats in Thunderbird
firefox-enterprise-91-release-notes,Firefox for Enterprise 91 - Release notes
whats-new-firefox-ios-version-36,What's new in Firefox for iOS (version 36)
set-firefox-your-default-browser-notification-pane,Set Firefox as your default browser from the notification panel on Android
how-obtain-shortened-mzlla-link,How to obtain a shortened mzl.la link
how-configure-close-tab-warnings-firefox,How to configure Close Tab warnings in Firefox
split-tunneling-app-permissions,Exclude applications from Mozilla VPN protection
support-forum-find-support-answers,Support forum - Find support answers
support-forum-offtopic-and-duplicate-questions,Support forum - Offtopic and duplicate questions
support-forum-how-to-follow-up,Support forum - How to follow up
support-forum-how-to-escalate,Support forum - How to escalate
how-contribute-support-forum,How to contribute to the Support Forum
support-forum-post-replies,Support forum - Post replies
whats-new-firefox-ios-version-37,What's new in Firefox for iOS (version 37)
how-contribute-knowledge-base,How to contribute to the Knowledge Base
whats-new-firefox-klar-android,What's new in Firefox Klar for Android
how-share-urls-firefox-macos,How to share URLs on Firefox for macOS
firefox-enterprise-92-release-notes,Firefox for Enterprise 92 - Release notes
how-manually-add-accounts-password-manager-firefox,How to manually add accounts to the password manager in Firefox for iOS
how-restore-browsing-session-backup,How to restore a browsing session from backup
how-can-i-contact-support-if-i-cant-log-mozilla-vp,How can I contact support if I can’t sign in to Mozilla VPN
contributors-guide-firefox-advanced-customization,Contributors guide on Firefox advanced customization with CSS
multi-hop-encrypt-your-data-twice-enhanced-security,Multi-Hop - Encrypt your data twice for enhanced security while using Mozilla VPN
troubleshooting-speed-issues-mozilla-vpn,Troubleshooting speed issues on Mozilla VPN
set-firefox-focus-default-browser-ios,Set Firefox Focus as the default browser for iOS
set-firefox-klar-default-browser-ios,Set Firefox Klar as the default browser for iOS
whats-new-firefox-ios-version-38,What's new in Firefox for iOS (version 38)
firefox-enterprise-93-release-notes,Firefox for Enterprise 93 - Release notes
how-remove-mozilla-vpn-app-data-your-device,How do I reset Mozilla VPN?
whats-new-firefox-ios-version-39,What's new in Firefox for iOS (version 39)
use-multi-account-containers-mozilla-vpn,Use Multi-Account Containers with Mozilla VPN
view-recent-tabs-on-firefox-ios-homepage,View recent tabs on your Firefox for iOS homepage
view-recently-saved-bookmarks-firefox-ios-homepage,View recently saved bookmarks from your homepage on Firefox for iOS
view-recent-bookmarks-and-searches-firefox-android-home,View bookmarks on your home screen
view-recent-tabs-firefox-android-homepage,View recent tabs on your Firefox for Android homepage
firefox-advanced-customization-and-configuration,Firefox advanced customization and configuration options
unload-inactive-tabs-save-system-memory-firefox,Unload inactive tabs to save system memory in Firefox
change-your-theme-firefox-focus-android,Change your theme in Firefox Focus for Android
change-your-theme-firefox-klar-android,Change your theme in Firefox Klar for Android
use-labels-keep-your-masks-organized-firefox-relay,Use labels to keep your masks organized in Firefox Relay
whats-new-klar-ios-39,What's New in Firefox Klar for iOS (version 39)
firefox-enterprise-94-release-notes,Firefox for Enterprise 94 - Release notes
change-your-theme-firefox-focus-ios,Change your theme in Firefox Focus for iOS
change-your-theme-firefox-klar-ios,Change your theme in Firefox Klar for iOS
usage-data-changes-firefox-ios-and-android,Usage Data Changes for Firefox for iOS and Android
personalize-firefox-colorways,Personalize Firefox with colorways
download-firefox-windows-microsoft-store,Download Firefox on Windows from the Microsoft Store
what-do-after-you-have-subscribed-mozilla-vpn,What to do after you have subscribed to Mozilla VPN
language-websites-i-visit-changes-when-i-turn-mozilla-vpn-on-what-to-do,The language of the websites I visit changes when I turn Mozilla VPN on - What to do
how-do-i-uninstall-mozilla-vpn,How do I uninstall Mozilla VPN?
firefox-relay-premium-faq,Firefox Relay Premium FAQ
register-your-own-domain-firefox-relay-premium,Register your own domain with Firefox Relay Premium
subscribe-firefox-relay-premium,Subscribe to Firefox Relay Premium
how-do-i-request-refund-firefox-relay-premium,How do I request a refund for Firefox Relay Premium
how-do-i-contact-support-relay-premium,How do I contact support for Relay Premium?
reply-forwarded-emails-firefox-relay-premium,Reply to forwarded emails with Firefox Relay Premium
forgot-password-firefox-relay,I forgot my password for Mozilla account and I can't sign in to Firefox Relay
end-of-support-firefox-lockwise,End of support for Firefox Lockwise
how-do-i-install-firefox-relay-extension,Install the Firefox Relay extension on Firefox for desktop
firefox-relay-what-email-mask,Firefox Relay - Email and Phone masks
download-beta-and-nightly-focus-android,Download the Beta and Nightly versions of Firefox Focus for Android
firefox-enterprise-95-release-notes,Firefox for Enterprise 95 - Release notes
whats-new-firefox-ios-version-40,What's new in Firefox for iOS (version 40)
view-articles-recommended-pocket-firefox-ios,View articles recommended by Pocket on your Firefox for iOS homepage
choose-your-opening-screen-firefox-ios,Choose your opening screen for Firefox for iOS
how-do-i-update-mozilla-vpn,How do I update Mozilla VPN?
safe-browsing-firefox-klar,Safe browsing in Firefox Klar
add-web-page-shortcuts-your-home-screen-firefox-klar,Add web page shortcuts to your Home screen in Firefox Klar
add-search-engine-firefox-klar-android,Add a search engine to Firefox klar for Android
remove-search-engine-firefox-klar-android,Remove a search engine in Firefox Klar for Android
autocomplete-settings-firefox-klar-address-bar,Autocomplete settings in the Firefox Klar address bar
add-search-engines-firefox-klar-ios,Add search engines in Firefox Klar for iOS
remove-search-engine-firefox-klar-ios,Remove a search engine in Firefox Klar for iOS
autocomplete-web-addresses-url-bar-firefox-klar-io,Autocomplete web addresses in the URL bar in Firefox Klar for iOS
tracking-protection-firefox-klar-ios,Tracking Protection on Firefox Klar for iOS
whats-new-firefox-ios-version-96,What's new in Firefox for iOS (version 96)
delete-individual-tab-firefox-focus-android,Delete an individual tab in Firefox Focus for Android
how-opt-out-studies-firefox-klar-ios,How to opt out of studies on Firefox Klar for iOS
whats-new-firefox-klar-ios-version-40,What's new in Firefox Klar for iOS (version 40)
firefox-enterprise-96-release-notes,Firefox for Enterprise 96 - Release notes
what-do-after-data-breach,What to do after a data breach
manage-downloads-preferences-using-downloads-menu,How file downloads are handled in Firefox
https-only-prefs-focus,HTTPS-Only Mode in Firefox Focus for Android
whats-new-firefox-ios-version-97,What's new in Firefox for iOS (version 97)
firefox-relay-how-reuse-email-masks,Quickly access previously generated masks
firefox-enterprise-97-release-notes,Firefox for Enterprise 97 - Release notes
whats-new-firefox-klar-ios-version-97,What's new in Firefox Klar for iOS (version 97)
search-engine-removal,My default search engine changed after updating Firefox
how-move-address-bar-firefox-ios,How to move the address bar in Firefox for iOS
total-cookie-protection-and-website-breakage-faq,Total Cookie Protection and website breakage FAQ
clear-cookies-and-website-data-single-domain-android,Clear cookies and website data for a single domain in Firefox for Android
change-your-wallpaper-firefox-ios,Change your wallpaper in Firefox for iOS
change-your-wallpaper-firefox-android,Change your wallpaper in Firefox for Android
whats-new-firefox-ios-version-98,What's new in Firefox for iOS (version 98)
firefox-enterprise-98-release-notes,Firefox for Enterprise 98 - Release notes
whats-new-firefox-klar-ios-version-98,What's new in Firefox Klar for iOS (version 98)
delete-individual-tab-firefox-klar-android,Delete an individual tab in Firefox Klar for Android
https-only-mode-firefox-klar-android,HTTPS-Only Mode in Firefox Klar for Android
receive-only-important-emails-sent-through-your-ma,Receive only important emails sent through your masks with Firefox Relay Premium
how-enable-always-vpn-android,How to enable Always-on VPN on Android
difficulties-opening-or-using-website-firefox-100,Difficulties opening or using a website in Firefox 100
difficulties-firefox-focus-android-100,Difficulties opening or using a website in Firefox Focus for Android 100
introducing-total-cookie-protection-standard-mode,Introducing Total Cookie Protection in Standard Mode
whats-difference-between-mdn-and-mdn-plus,What's the difference between MDN and MDN Plus?
add-and-delete-collections-mdn-plus,Add and delete collections in MDN Plus
receive-notifications-mdn-plus,Receive notifications in MDN Plus
enable-light-or-dark-mode-mdn,Enable light or dark mode in MDN
how-do-i-contact-mdn-plus-support,How do I contact MDN Plus support?
how-do-i-contact-mdn-plus-support-if-i-forgot-my-p,How do I contact MDN Plus support if I forgot my password for Mozilla account?
i-forgot-my-password-firefox-mdn-plus,I forgot my Password for Mozilla account and I can't sign in to MDN Plus
how-do-i-cancel-my-subscription-mdn-plus,How do I cancel my subscription to MDN Plus?
how-do-i-update-my-payment-information-my-mdn-plus,How do I update my payment information for my MDN Plus subscription?
where-can-i-view-my-mdn-plus-subscription-informat,Where can I view my MDN Plus subscription information?
how-do-i-request-refund-mdn-plus,How do I request a refund for MDN Plus?
how-do-i-change-my-mdn-plus-subscription-plan,How do I change my MDN Plus subscription plan?
how-can-i-help-submit-and-resolve-bugs-mdn-content,How can I help submit and resolve bugs in the MDN content repo?
where-can-i-get-help-mdn-api-and-documentation,Where can I get help with the MDN API and documentation?
difficulties-website-firefox-klar-android-100,Difficulties with a website in Firefox Klar for Android 100
firefox-enterprise-99-release-notes,Firefox for Enterprise 99 - Release notes
whats-new-firefox-ios-version-99,What's new in Firefox for iOS (version 99)
automatic-conversion-google-mail-accounts-oauth20,Automatic Conversion of Google mail accounts to OAuth 2.0 Authentication
importing-bookmarks-firefox-android,Import bookmarks to Firefox for Android
change-website-appearance-settings-firefox,Change website appearance settings in Firefox
how-sign-mozilla-vpn,How to sign up for Mozilla VPN
how-log-mozilla-vpn,How to sign in to Mozilla VPN
how-do-i-restore-my-mozilla-vpn-subscription,How do I restore my Mozilla VPN Subscription on my mobile device?
whats-new-firefox-ios-version-100,What's new in Firefox for iOS (version 100)
openpgp-unsafe-key-properties-ignored,Unsafe properties of OpenPGP keys might be ignored
firefox-enterprise-100-release-notes,Firefox for Enterprise 100 - Release notes
search-your-browsing-history-firefox-ios,Search your browsing history in Firefox for iOS
search-your-browsing-history-and-bookmarks-firefox,Search your browsing history and bookmarks in Firefox for Android
https-only-mode-firefox-android,HTTPS-Only Mode in Firefox for Android
new-thunderbird-102,New in Thunderbird 102
whats-new-firefox-klar-ios-version-99,What's new in Firefox Klar for iOS (version 99)
safari-integration-firefox-ios,Safari Integration in Firefox Focus for iOS
automatically-launch-mozilla-vpn-when-your-device,Automatically launch Mozilla VPN when your device starts
what-mozilla-connect,What is Mozilla Connect?
custom-installation-thunderbird-windows,Custom installation of Thunderbird on Windows
whats-new-firefox-ios-version-101,What's new in Firefox for iOS (version 101)
mozilla-vpn-faq,Mozilla VPN - FAQ
what-are-email-trackers-and-how-can-i-block-them-firefox-relay,What are email trackers and how can I block them with Firefox Relay?
why-do-i-see-white-screen-after-updating-mozilla-v283,Why do I see a white screen after updating Mozilla VPN to version 2.8.3?
change-site-permissions-firefox-focus-android,Change site permissions in Firefox Focus for Android
change-site-permissions-firefox-klar-android,Change site permissions in Firefox Klar for Android
firefox-enterprise-101-release-notes,Firefox for Enterprise 101 - Release notes
view-articles-recommended-pocket-firefox-new-tab-homepage,View articles recommended by Pocket on your Firefox New Tab and homepage
get-familiar-firefox-android,Get familiar with Firefox for Android
get-familiar-firefox-ios,Get familiar with Firefox for iOS
get-familiar-firefox-focus,Get familiar with Firefox Focus
participate-early-testing-foxfooding,Participate in early testing (foxfooding)
get-know-mozilla,Get to know Mozilla
mozilla-official-support-channels,Mozilla official support channels
stay-updated-firefox-releases,How to stay updated with Firefox release
thunderbird-help-cannot-encrypt,Prerequisite for sending an encrypted email message
thunderbird-help-openpgp-alias,Thunderbird and OpenPGP Alias Keys
thunderbird-help-openpgp-counterfeit-key,OpenPGP keys might be authentic or counterfeit
whats-new-firefox-ios-version-102,What's new in Firefox for iOS (version 102)
thunderbird-help-setup-account-e2ee,Setup your email account for using End-To-End Encryption
how-set-tab-pickup-firefox-view,"Firefox View - Access pages from open tabs, recently closed tabs, tabs from other devices and browsing history"
firefox-enterprise-102-release-notes,Firefox for Enterprise 102 - Release notes
thunderbird-export,Export your Thunderbird Profile
thunderbird-import,Import settings and data into Thunderbird
which-countries-mdn-plus-available-subscribe,In which countries is MDN Plus available to subscribe?
which-countries-firefox-relay-premium-available-subscribe,In which countries is Firefox Relay Premium available to subscribe?
troubleshoot-mozilla-vpn-connection-problems,Troubleshoot Mozilla VPN connection problems
firefox-translations-add-on,Firefox Translations Add-on
how-upgrade-your-mdn-plus-subscription,How to upgrade your MDN Plus subscription
i-cant-sign-mozilla-vpn-what-should-i-do,I can't sign in to Mozilla VPN - What should I do?
whats-new-firefox-ios-version-103,What's new in Firefox for iOS (version 103)
